{
  "source": "N:\\Конференції\\Конференції_zip\\95_м_Оксфорд,_Велика_Британія,_6_8_лютого_2026_року.zip",
  "source_type": "zip",
  "workspace_source": "build\\jfv_b\\Conference95\\workspace\\source",
  "file_count": 139,
  "files": [
    {
      "path": "95_м_Оксфорд,_Велика_Британія,_6_8_лютого_2026_року/95 м. Оксфорд, Велика Британія, 6-8 лютого 2026 року/95Оксфорд_Обкладинка.png",
      "size": 901105,
      "extension": ".png",
      "sha256": "0df77b42f544360e22b7e0f5e15fea7659f9d8f011006e6aee1898564d851964",
      "article_candidate": false,
      "service_file": false
    },
    {
      "path": "95_м_Оксфорд,_Велика_Британія,_6_8_лютого_2026_року/95 м. Оксфорд, Велика Британія, 6-8 лютого 2026 року/New_Інформаційний лист 95 м. Оксфорд, Велика Британія, 6-8 лютого 2026 року.docx",
      "size": 249204,
      "extension": ".docx",
      "sha256": "15cf3e0eadd932895573b14173f6b4013fc9464cf4aae6ff26bbade5baf72e3c",
      "article_candidate": true,
      "service_file": false
    },
    {
      "path": "95_м_Оксфорд,_Велика_Британія,_6_8_лютого_2026_року/95 м. Оксфорд, Велика Британія, 6-8 лютого 2026 року/Анкета-заявка.doc",
      "size": 43008,
      "extension": ".doc",
      "sha256": "fa62e0280204714075b5c43c458f899129b7454f5c5fa245da29621e4916e3c0",
      "article_candidate": true,
      "service_file": false
    },
    {
      "path": "95_м_Оксфорд,_Велика_Британія,_6_8_лютого_2026_року/95 м. Оксфорд, Велика Британія, 6-8 лютого 2026 року/Заявки/1 Кравченко/04B6B21A-2D3D-4DD2-9766-46D2878653E0.pdf",
      "size": 172812,
      "extension": ".pdf",
      "sha256": "f511135275b05f688fffd75e939fe3a1b938d0f0a75a53070310df78881e9b79",
      "article_candidate": false,
      "service_file": false
    },
    {
      "path": "95_м_Оксфорд,_Велика_Британія,_6_8_лютого_2026_року/95 м. Оксфорд, Велика Британія, 6-8 лютого 2026 року/Заявки/1 Кравченко/New_Тези Оксфорд.docx",
      "size": 76848,
      "extension": ".docx",
      "sha256": "365ab241df5b4825fd85fbb4a4800b51675aa2a760609d30adccf3f339cea6f2",
      "article_candidate": true,
      "service_file": false
    },
    {
      "path": "95_м_Оксфорд,_Велика_Британія,_6_8_лютого_2026_року/95 м. Оксфорд, Велика Британія, 6-8 лютого 2026 року/Заявки/1 Кравченко/Анкета учасника.doc",
      "size": 43008,
      "extension": ".doc",
      "sha256": "158ac6d3ce989d92e271b8f252e9851d09b216ea5d79d8c1de732157f3b484fe",
      "article_candidate": true,
      "service_file": false
    },
    {
      "path": "95_м_Оксфорд,_Велика_Британія,_6_8_лютого_2026_року/95 м. Оксфорд, Велика Британія, 6-8 лютого 2026 року/Заявки/1 Кравченко/Тези Оксфорд.docx",
      "size": 86323,
      "extension": ".docx",
      "sha256": "052875c1ae0c41047a46c66b8a5d488b086c8e5b0e25196fcaa4c3234da31735",
      "article_candidate": true,
      "service_file": false
    },
    {
      "path": "95_м_Оксфорд,_Велика_Британія,_6_8_лютого_2026_року/95 м. Оксфорд, Велика Британія, 6-8 лютого 2026 року/Заявки/10 Прибитько, Івкова/New_Прибитько.docx",
      "size": 22877,
      "extension": ".docx",
      "sha256": "aaf8e0c45ef44274d7d5e6a35e8c65f9d4c2dbc791f84a734553097ba1dbdb99",
      "article_candidate": true,
      "service_file": false
    },
    {
      "path": "95_м_Оксфорд,_Велика_Британія,_6_8_лютого_2026_року/95 м. Оксфорд, Велика Британія, 6-8 лютого 2026 року/Заявки/10 Прибитько, Івкова/Прибитько (2).docx",
      "size": 32028,
      "extension": ".docx",
      "sha256": "61b748d1fc91a5647d25fb7975a430cf06e662e861a0f1e4db7ed5ed11c42272",
      "article_candidate": true,
      "service_file": false
    },
    {
      "path": "95_м_Оксфорд,_Велика_Британія,_6_8_лютого_2026_року/95 м. Оксфорд, Велика Британія, 6-8 лютого 2026 року/Заявки/10 Прибитько, Івкова/Прибитько (2).pdf",
      "size": 238800,
      "extension": ".pdf",
      "sha256": "d77e5af829d75b31acf4daefee2b1ce47ffdfa60e3b20374e8676e08a2426e19",
      "article_candidate": false,
      "service_file": false
    },
    {
      "path": "95_м_Оксфорд,_Велика_Британія,_6_8_лютого_2026_року/95 м. Оксфорд, Велика Британія, 6-8 лютого 2026 року/Заявки/10 Прибитько, Івкова/Прибитько.docx",
      "size": 23209,
      "extension": ".docx",
      "sha256": "d1dab8a27e1269afd0c6d90c5fdbefed5bdaab56da118c90ddf9f8b50c3aa086",
      "article_candidate": true,
      "service_file": false
    },
    {
      "path": "95_м_Оксфорд,_Велика_Британія,_6_8_лютого_2026_року/95 м. Оксфорд, Велика Британія, 6-8 лютого 2026 року/Заявки/10 Прибитько, Івкова/Прибитько.pdf",
      "size": 238641,
      "extension": ".pdf",
      "sha256": "9a5c0b986e0ff205c5ed0ceba126090c46cd80b07e1197101e7956ae21a5fc84",
      "article_candidate": false,
      "service_file": false
    },
    {
      "path": "95_м_Оксфорд,_Велика_Британія,_6_8_лютого_2026_року/95 м. Оксфорд, Велика Британія, 6-8 лютого 2026 року/Заявки/11 Стрельченко/Стрельченко О.О..doc",
      "size": 44544,
      "extension": ".doc",
      "sha256": "70ba64deb3df216e5f69ea6ed56bd5d30ff485895ae441b6d9c44cf5baf78aa7",
      "article_candidate": true,
      "service_file": false
    },
    {
      "path": "95_м_Оксфорд,_Велика_Британія,_6_8_лютого_2026_року/95 м. Оксфорд, Велика Британія, 6-8 лютого 2026 року/Заявки/11 Стрельченко/Стрельченко О.О.pdf",
      "size": 238747,
      "extension": ".pdf",
      "sha256": "059a09bc4f980cf3dc222676ad3097cf4497f361159b3e5bcd154c2a6049809d",
      "article_candidate": false,
      "service_file": false
    },
    {
      "path": "95_м_Оксфорд,_Велика_Британія,_6_8_лютого_2026_року/95 м. Оксфорд, Велика Британія, 6-8 лютого 2026 року/Заявки/11 Стрельченко/Стрельченко Олена Олексіївна.docx",
      "size": 36748,
      "extension": ".docx",
      "sha256": "9490b6596111dd8339ab148b5646b5abc80573e62bb6b8aaee65dbb57bd8c163",
      "article_candidate": true,
      "service_file": false
    },
    {
      "path": "95_м_Оксфорд,_Велика_Британія,_6_8_лютого_2026_року/95 м. Оксфорд, Велика Британія, 6-8 лютого 2026 року/Заявки/12 Толкова (БП)/Толкова анкета_6c6ea377-667f-4510-afd8-86110964f0e9.docx",
      "size": 21631,
      "extension": ".docx",
      "sha256": "a92090b7c2d991f73ec1d3447476b124b72f905f041f5e63bdc58d4bd39455f5",
      "article_candidate": true,
      "service_file": false
    },
    {
      "path": "95_м_Оксфорд,_Велика_Британія,_6_8_лютого_2026_року/95 м. Оксфорд, Велика Британія, 6-8 лютого 2026 року/Заявки/12 Толкова (БП)/Толкова квитанція_c1dedb10-b96a-45b9-9c00-eebe035ee982.pdf",
      "size": 238794,
      "extension": ".pdf",
      "sha256": "bcb6ceee45a5b649ee060a569466eba6c1dc90f2d9587c6e9c3b8f6db257b8b4",
      "article_candidate": false,
      "service_file": false
    },
    {
      "path": "95_м_Оксфорд,_Велика_Британія,_6_8_лютого_2026_року/95 м. Оксфорд, Велика Британія, 6-8 лютого 2026 року/Заявки/13 Сидоренко/Анкета учасника.docx",
      "size": 31710,
      "extension": ".docx",
      "sha256": "62aeffce2194bd4a734f858df8ab07a6591893cf0b67409347779187c211f17d",
      "article_candidate": true,
      "service_file": false
    },
    {
      "path": "95_м_Оксфорд,_Велика_Британія,_6_8_лютого_2026_року/95 м. Оксфорд, Велика Британія, 6-8 лютого 2026 року/Заявки/13 Сидоренко/Квитанція про оплату.pdf",
      "size": 238783,
      "extension": ".pdf",
      "sha256": "20680bc5b42e6d3e628f29acf88963469918f9200207ce182c58c91bad884799",
      "article_candidate": false,
      "service_file": false
    },
    {
      "path": "95_м_Оксфорд,_Велика_Британія,_6_8_лютого_2026_року/95 м. Оксфорд, Велика Британія, 6-8 лютого 2026 року/Заявки/13 Сидоренко/Стаття Цифрова зрілість Сидоренко С. Ю..docx",
      "size": 28530,
      "extension": ".docx",
      "sha256": "2591eae01d7a6badf5374b716b7aeb132a9400212926a44b8a5f4ee288079637",
      "article_candidate": true,
      "service_file": false
    },
    {
      "path": "95_м_Оксфорд,_Велика_Британія,_6_8_лютого_2026_року/95 м. Оксфорд, Велика Британія, 6-8 лютого 2026 року/Заявки/14 Пилипенко/unnamed.jpg",
      "size": 121434,
      "extension": ".jpg",
      "sha256": "25af0eec3b7bb93df09e8abed3438baacfe7c782ab7b89d1155a5bca2eb57ca2",
      "article_candidate": false,
      "service_file": false
    },
    {
      "path": "95_м_Оксфорд,_Велика_Британія,_6_8_лютого_2026_року/95 м. Оксфорд, Велика Британія, 6-8 лютого 2026 року/Заявки/14 Пилипенко/Заявка і стаття.docx",
      "size": 29490,
      "extension": ".docx",
      "sha256": "7188b3d74b0cb6b3b2153b8e5f82c5211a1e1002bbb56f8564cb5d835f7e98f7",
      "article_candidate": true,
      "service_file": false
    },
    {
      "path": "95_м_Оксфорд,_Велика_Британія,_6_8_лютого_2026_року/95 м. Оксфорд, Велика Британія, 6-8 лютого 2026 року/Заявки/15 Резніков/Methods for Forming Enterprise Development Strategies Based on Digital Technologies under Global Crises.docx",
      "size": 1961721,
      "extension": ".docx",
      "sha256": "f43da66e0c7096630365f6b96c565f27075c550e37919a1923f6b5618c66095b",
      "article_candidate": true,
      "service_file": false
    },
    {
      "path": "95_м_Оксфорд,_Велика_Британія,_6_8_лютого_2026_року/95 м. Оксфорд, Велика Британія, 6-8 лютого 2026 року/Заявки/16 Полях (БП)/Component.pdf",
      "size": 238627,
      "extension": ".pdf",
      "sha256": "7b6dee896249b53d97901aabc3230b8a699d3f9a127a27ff8bbfb48db34f8470",
      "article_candidate": false,
      "service_file": false
    },
    {
      "path": "95_м_Оксфорд,_Велика_Британія,_6_8_лютого_2026_року/95 м. Оксфорд, Велика Британія, 6-8 лютого 2026 року/Заявки/16 Полях (БП)/АНКЕТА УЧАСНИКА.docx",
      "size": 17778,
      "extension": ".docx",
      "sha256": "e6aca09bc75429ed3ea63366dd5c4cc96b93e7dc4fa6c24d2546c616e235b594",
      "article_candidate": true,
      "service_file": false
    },
    {
      "path": "95_м_Оксфорд,_Велика_Британія,_6_8_лютого_2026_року/95 м. Оксфорд, Велика Британія, 6-8 лютого 2026 року/Заявки/17 Шаповалова/0-02-05-98bdd1603fef5a2e67192e03895b702ec1808994e9d2fe0e9eb4ec5f1ec2fbba_8c74921d7156e860.jpg",
      "size": 85779,